[
  {
    "question": "I need to schedule a system architecture review meeting for our payment processing components. First, can you help me explore what architecture documentation we have available? Then, I need to set up a meeting at 14:00 Tokyo time - what would that be in New York time?",
    "tool_calls": [
      {
        "tool_name": "list-projects",
        "parameters": {}
      },
      {
        "tool_name": "read-project-summary",
        "parameters": {}
      },
      {
        "tool_name": "search-element",
        "parameters": {
          "search": "payment"
        }
      },
      {
        "tool_name": "convert_time",
        "parameters": {
          "source_timezone": "Asia/Tokyo",
          "target_timezone": "America/New_York",
          "time": "14:00"
        }
      }
    ],
    "servers": {
      "@likec4/mcp": [
        "list-projects",
        "read-project-summary",
        "search-element"
      ],
      "time": [
        "convert_time"
      ]
    },
    "idx": 161
  }
]
